<?xml version="1.0" encoding="UTF-8"?>
<?xml-stylesheet type = "text/xsl" href = "../Converter.xsl"?> 
<armours xmlns:xsi="http://www.w3.org/2001/XMLSchema-instance" xsi:noNamespaceSchemaLocation="../xml.xsd">
    <armour>
        <name>Ballistic Jacket</name>
        <type>Light Armour</type>
        <type>Physical Armour</type>
        <type>Armour</type>
        <cost>150</cost>
        <save>Physical</save>
        <modifier>1</modifier>
    </armour>
    <armour>
        <name>Plated Chestpeice</name>
        <type>Medium Armour</type>
        <type>Physical Armour</type>
        <type>Armour</type>
        <cost>200</cost>
        <passiveEffect>
            <speedIncrease>-0.1</speedIncrease>
            <!---0.1m/s speed-->
        </passiveEffect>
        <save>Physical</save>
        <modifier>2</modifier>
    </armour>
    <armour>
        <name>Full Cover Plating</name>
        <type>Heavy Armour</type>
        <type>Physical Armour</type>
        <type>Armour</type>
        <cost>500</cost>
        <passiveEffect>
            <speedIncrease>-0.5</speedIncrease>
        </passiveEffect>
        <save>Physical</save>
        <modifier>3</modifier>
    </armour>
</armours>